[
  {
    "claim_id": "BFB-HLT-0005",
    "claim_text_bn": "অ্যালোপ্যাথিক ওষুধের চেয়ে দেশীয় কবিরাজি ব্যবস্থাপনাই মানুষের দীর্ঘায়ুর মূল রহস্য।",
    "domain": "health",
    "source_type": "social_media",
    "source_name": "YouTube Health Channel",
    "source_url": "https://fact-watch.org/traditional-vs-allopathic-health-views/",
    "publication_date": "2022-09-18",
    "claim_date": "2022-09-10",
    "language": "bn",
    "language_variant": "colloquial_bengali",
    "speaker_or_author_if_public": "Natural Healer BD",
    "context": "সনাতন চিকিৎসা পদ্ধতি বনাম আধুনিক চিকিৎসার দ্বন্দ্বে জনমত তৈরির উদ্দেশ্যে উপস্থাপিত বক্তব্য।",
    "evidence_urls": [
      "https://www.who.int/health-topics/traditional-complementary-and-integrative-medicine"
    ],
    "evidence_text": "দীর্ঘায়ু এবং স্বাস্থ্য ব্যবস্থাপনায় কোনো একক পদ্ধতিকে একমাত্র রহস্য হিসেবে দাবি করার কোনো সার্বজনীন বা পরিমাপযোগ্য বৈজ্ঞানিক ভিত্তি নেই; এটি ব্যক্তিগত মূল্যায়ন ও বিশ্বাসপ্রসূত মতামতের অংশ।",
    "label": "OPINION",
    "confidence": 0.95,
    "annotation_notes": "ব্যক্তিগত বিশ্বাস ও দৃষ্টিভঙ্গিপ্রসূত মূল্যায়ন; কোনো নির্দিষ্ট পরীক্ষাযোগ্য ডেটা নেই।",
    "annotator_1": "OPINION",
    "annotator_2": "OPINION",
    "adjudicated_label": "OPINION",
    "claim_text_normalized": "অ্যালোপ্যাথিক ওষুধের চেয়ে দেশীয় কবিরাজি ব্যবস্থাপনাই মানুষের দীর্ঘায়ুর মূল রহস্য।"
  },
  {
    "claim_id": "BFB-POL-0001",
    "claim_text_bn": "বাংলাদেশ জাতীয় সংসদের মোট আসন সংখ্যা ৩৫০টি, যার মধ্যে ৫০টি আসন নারীদের জন্য সংরক্ষিত।",
    "domain": "politics",
    "source_type": "news_portal",
    "source_name": "Bangladesh Parliament Secretariat",
    "source_url": "http://www.parliament.gov.bd/index.php/en/about-parliament/parliamentary-overview",
    "publication_date": "2023-02-10",
    "claim_date": "2023-02-01",
    "language": "bn",
    "language_variant": "standard_bengali",
    "speaker_or_author_if_public": "Parliament Secretariat Record",
    "context": "বাংলাদেশের সংবিধান ও সংসদীয় কাঠামো বিষয়ক সাধারণ তথ্য।",
    "evidence_urls": [
      "http://bdlaws.minlaw.gov.bd/act-367/section-24549.html",
      "http://www.parliament.gov.bd"
    ],
    "evidence_text": "গণপ্রজাতন্ত্রী বাংলাদেশের সংবিধানের ৬৫(৩) অনুচ্ছেদ অনুযায়ী জাতীয় সংসদে ৩০০ জন প্রত্যক্ষ ভোটে নির্বাচিত সদস্য এবং ৫০টি সংরক্ষিত নারী আসন মিলিয়ে মোট ৩৫০টি আসন নির্ধারিত।",
    "label": "SUPPORTED",
    "confidence": 1.0,
    "annotation_notes": "সংবিধানের সুনির্দিষ্ট আইন অনুচ্ছেদ দ্বারা প্রত্যক্ষভাবে সমর্থিত।",
    "annotator_1": "SUPPORTED",
    "annotator_2": "SUPPORTED",
    "adjudicated_label": "SUPPORTED",
    "claim_text_normalized": "বাংলাদেশ জাতীয় সংসদের মোট আসন সংখ্যা ৩৫০টি, যার মধ্যে ৫০টি আসন নারীদের জন্য সংরক্ষিত।"
  },
  {
    "claim_id": "BFB-FIN-0007",
    "claim_text_bn": "সরকার মোবাইল ব্যাংকিং লেনদেনের ওপর অতিরিক্ত ৫% গোপন ট্যাক্স কর্তন শুরু করেছে।",
    "domain": "finance",
    "source_type": "social_media",
    "source_name": "Facebook Group Post",
    "source_url": "https://rumorscanner.com/fact-checks/economy/mfs-secret-tax-false-rumor/8712",
    "publication_date": "2023-08-04",
    "claim_date": "2023-08-02",
    "language": "bn",
    "language_variant": "colloquial_bengali",
    "speaker_or_author_if_public": "Viral Post",
    "context": "এমএফএস (বিকাশ, নগদ) ফি বৃদ্ধির দাবি করে ভুয়া স্ক্রিনশট ভাইরাল।",
    "evidence_urls": [
      "https://nbr.gov.bd",
      "https://www.bb.org.bd/mediaroom/press_release"
    ],
    "evidence_text": "জাতীয় রাজস্ব বোর্ড ও সংশ্লিষ্ট এমএফএস প্রতিষ্ঠানগুলো নিশ্চিত করেছে যে লেনদেনের ওপর নতুন কোনো গোপন ৫% ট্যাক্স বা চার্জ আরোপ করা হয়নি। স্বাভাবিক ট্যারিফ অপরিবর্তিত রয়েছে।",
    "label": "REFUTED",
    "confidence": 1.0,
    "annotation_notes": "বানোয়াট স্ক্রিনশটভিত্তিক অসত্য গুজব।",
    "annotator_1": "REFUTED",
    "annotator_2": "REFUTED",
    "adjudicated_label": "REFUTED",
    "claim_text_normalized": "সরকার মোবাইল ব্যাংকিং লেনদেনের ওপর অতিরিক্ত ৫% গোপন ট্যাক্স কর্তন শুরু করেছে।"
  },
  {
    "claim_id": "BFB-DIS-0005",
    "claim_text_bn": "বাংলাদেশ আবহাওয়া অধিদপ্তর আগামী ২৪ ঘণ্টার মধ্যে ঢাকায় রিখটার স্কেলে ৯ মাত্রার ভয়াবহ ভূমিকম্পের চূড়ান্ত পূর্বাভাস দিয়েছে।",
    "domain": "disaster",
    "source_type": "social_media",
    "source_name": "Facebook Warning Post",
    "source_url": "https://rumorscanner.com/fact-checks/environment/earthquake-prediction-rumor-false/9981",
    "publication_date": "2023-12-03",
    "claim_date": "2023-12-02",
    "language": "bn",
    "language_variant": "colloquial_bengali",
    "speaker_or_author_if_public": "Panic Creator Page",
    "context": "হালকা ভূমিকম্প অনুভূত হওয়ার পর সুনির্দিষ্ট সময় ও মাত্রাসহ ভুয়া পূর্বাভাস ছড়ানো হয়।",
    "evidence_urls": [
      "https://www.bmd.gov.bd",
      "https://earthquake.usgs.gov/learn/topics/prediction.php"
    ],
    "evidence_text": "যুক্তরাষ্ট্রের ভূ-তাত্ত্বিক জরিপ সংস্থা (USGS) এবং বাংলাদেশ আবহাওয়া অধিদপ্তর স্পষ্ট করেছে যে আধুনিক বিজ্ঞানের দ্বারা কোনো ভূমিকম্পের সুনির্দিষ্ট দিন, ক্ষণ বা ঘণ্টা আগে থেকে পূর্বাভাস দেওয়া অসম্ভব। দাবিটি সম্পূর্ণ অসত্য গুজব।",
    "label": "REFUTED",
    "confidence": 1.0,
    "annotation_notes": "ভূমিকম্প বিজ্ঞান ও আবহাওয়া অধিদপ্তরের স্বীকৃত মূলনীতির সম্পূর্ণ পরিপন্থী গুজব।",
    "annotator_1": "REFUTED",
    "annotator_2": "REFUTED",
    "adjudicated_label": "REFUTED",
    "claim_text_normalized": "বাংলাদেশ আবহাওয়া অধিদপ্তর আগামী ২৪ ঘণ্টার মধ্যে ঢাকায় রিখটার স্কেলে ৯ মাত্রার ভয়াবহ ভূমিকম্পের চূড়ান্ত পূর্বাভাস দিয়েছে।"
  },
  {
    "claim_id": "BFB-SCI-0009",
    "claim_text_bn": "সম্প্রতি বুয়েটের একজন শিক্ষার্থী এমন একটি ব্যাটারি তৈরি করেছেন যা দিয়ে একবার চার্জে বৈদ্যুতিক গাড়ি ৫০ বছর চলবে বলে দাবি করা হয়েছে।",
    "domain": "sci_tech",
    "source_type": "social_media",
    "source_name": "Facebook Post",
    "source_url": "https://fact-watch.org/buet-perpetual-battery-claim-unverified/",
    "publication_date": "2023-11-19",
    "claim_date": "2023-11-18",
    "language": "bn",
    "language_variant": "colloquial_bengali",
    "speaker_or_author_if_public": "Tech Group Member",
    "context": "দেশি উদ্ভাবনের ভুয়া গল্প তৈরি করে সোশ্যাল মিডিয়ায় জনপ্রিয়তা অর্জনের চেষ্টা।",
    "evidence_urls": [
      "https://buet.ac.bd",
      "https://fact-watch.org/buet-perpetual-battery-claim-unverified/"
    ],
    "evidence_text": "বুয়েটের সংশ্লিষ্ট বিভাগ বা কোনো অথরাইজড বৈজ্ঞানিক জার্নালে এই ধরণের কোনো ব্যাটারির উদ্ভাবন বা পেটেন্ট জমা হয়নি এবং পদার্থবিজ্ঞানের শক্তির সংরক্ষণশীলতা নীতি অনুযায়ী এটি অযৌক্তিক। দাবিটির কোনো নিশ্চিত ভিত্তি নেই।",
    "label": "UNVERIFIABLE",
    "confidence": 0.9,
    "annotation_notes": "কোনো প্রাতিষ্ঠানিক বৈজ্ঞানিক প্রমাণের অস্তিত্ব নেই।",
    "annotator_1": "UNVERIFIABLE",
    "annotator_2": "UNVERIFIABLE",
    "adjudicated_label": "UNVERIFIABLE",
    "claim_text_normalized": "সম্প্রতি বুয়েটের একজন শিক্ষার্থী এমন একটি ব্যাটারি তৈরি করেছেন যা দিয়ে একবার চার্জে বৈদ্যুতিক গাড়ি ৫০ বছর চলবে বলে দাবি করা হয়েছে।"
  },
  {
    "claim_id": "BFB-SOC-0005",
    "claim_text_bn": "ইউনেস্কো ১৯৯৯ সালে ২১শে ফেব্রুয়ারিকে আন্তর্জাতিক মাতৃভাষা দিবস হিসেবে আনুষ্ঠানিকভাবে স্বীকৃতি প্রদান করে।",
    "domain": "social",
    "source_type": "news_portal",
    "source_name": "UNESCO Official Heritage Portal",
    "source_url": "https://www.unesco.org/en/days/mother-language",
    "publication_date": "2023-02-21",
    "claim_date": "2023-02-21",
    "language": "bn",
    "language_variant": "standard_bengali",
    "speaker_or_author_if_public": "UNESCO Official Portal",
    "context": "আন্তর্জাতিক মাতৃভাষা দিবসের ঐতিহাসিক স্বীকৃতি।",
    "evidence_urls": [
      "https://www.unesco.org/en/days/mother-language",
      "https://mofa.gov.bd"
    ],
    "evidence_text": "১৯৯৯ সালের ১৭ নভেম্বর প্যারিসে অনুষ্ঠিত ইউনেস্কোর ৩০তম সাধারণ সম্মেলনে ২১শে ফেব্রুয়ারিকে আন্তর্জাতিক মাতৃভাষা দিবস হিসেবে স্বীকৃতির প্রস্তাব সর্বসম্মতিক্রমে গৃহীত হয় এবং ২০০০ সাল থেকে বিশ্বব্যাপী পালিত হয়ে আসছে।",
    "label": "SUPPORTED",
    "confidence": 1.0,
    "annotation_notes": "ইউনেস্কো ও আন্তর্জাতিক প্রাতিষ্ঠানিক রেকর্ড দ্বারা সম্পূর্ণরূপে প্রমাণিত ঐতিহাসিক সত্য।",
    "annotator_1": "SUPPORTED",
    "annotator_2": "SUPPORTED",
    "adjudicated_label": "SUPPORTED",
    "claim_text_normalized": "ইউনেস্কো ১৯৯৯ সালে ২১শে ফেব্রুয়ারিকে আন্তর্জাতিক মাতৃভাষা দিবস হিসেবে আনুষ্ঠানিকভাবে স্বীকৃতি প্রদান করে।"
  }
]